{
  "$schema": "https://json-schema.org/draft/2020-12/schema",
  "$id": "urn:amplytrix:schema:v1:scenario",
  "title": "Amplytrix scenario v1",
  "type": "object",
  "required": [
    "schema_version",
    "id",
    "project_id",
    "kind",
    "status",
    "summary",
    "gains",
    "renunciations",
    "client_effort",
    "risks",
    "advantages",
    "timeline",
    "cost",
    "consequences",
    "assumptions",
    "evidence_refs"
  ],
  "properties": {
    "$schema": { "type": "string" },
    "schema_version": { "$ref": "urn:amplytrix:schema:v1:common#/$defs/version" },
    "id": { "$ref": "urn:amplytrix:schema:v1:common#/$defs/id" },
    "project_id": { "$ref": "urn:amplytrix:schema:v1:common#/$defs/id" },
    "kind": { "enum": ["conservative", "realistic", "aggressive", "custom"] },
    "status": { "enum": ["draft", "proposed", "selected", "rejected", "superseded"] },
    "summary": { "type": "string", "minLength": 1 },
    "gains": { "$ref": "urn:amplytrix:schema:v1:common#/$defs/nonEmptyStrings" },
    "renunciations": { "$ref": "urn:amplytrix:schema:v1:common#/$defs/nonEmptyStrings" },
    "client_effort": { "$ref": "urn:amplytrix:schema:v1:common#/$defs/nonEmptyStrings" },
    "risks": { "$ref": "urn:amplytrix:schema:v1:common#/$defs/nonEmptyStrings" },
    "advantages": { "$ref": "urn:amplytrix:schema:v1:common#/$defs/nonEmptyStrings" },
    "timeline": { "type": "string", "minLength": 1 },
    "cost": { "$ref": "urn:amplytrix:schema:v1:common#/$defs/cost" },
    "consequences": { "$ref": "urn:amplytrix:schema:v1:common#/$defs/nonEmptyStrings" },
    "assumptions": { "$ref": "urn:amplytrix:schema:v1:common#/$defs/nonEmptyStrings" },
    "evidence_refs": { "$ref": "urn:amplytrix:schema:v1:common#/$defs/nonEmptyStrings" }
  },
  "additionalProperties": false
}
